{
  "$schema": "https://json-schema.org/draft/2020-12/schema",
  "$id": "https://agentic-skills.local/schemas/planning/task_graph.schema.json",
  "title": "TaskGraph", "type": "object", "additionalProperties": false,
  "required": ["graph_id", "goal_id", "entry_node_id", "nodes"],
  "properties": {"graph_id": {"type": "string", "minLength": 1}, "goal_id": {"type": "string", "minLength": 1}, "entry_node_id": {"type": "string", "minLength": 1}, "nodes": {"type": "array", "minItems": 1, "items": {"$ref": "https://agentic-skills.local/schemas/planning/graph_node.schema.json"}}, "edges": {"type": "array", "items": {"$ref": "https://agentic-skills.local/schemas/planning/graph_edge.schema.json"}}, "terminal_nodes": {"type": "array", "items": {"type": "string", "minLength": 1}}, "metadata": {"type": "object", "additionalProperties": false, "patternProperties": {"^.*$": {}}}}
}
