{"graph_id":"reject_workspace","goal_id":"move_fixture_pose_verified","entry_node_id":"act","nodes":[{"node_id":"act","kind":"ACT","capability_id":"motion.move_to_pose","arguments":{"frame":"base","xyz_m":[9.0,9.0,9.0],"source":"unsafe","side":"left"},"resource_requirements":[{"resource_id":"robot.dual_franka.shared_workspace","mode":"exclusive","description":"resource"}],"verifier":{"mode":"predicate","predicate":{"operator":"exists","operands":[{"predicate":"robot.pose"}]}}}],"terminal_nodes":["act"]}
