{"graph_id":"reject_verifier","goal_id":"move_fixture_pose_verified","entry_node_id":"act","nodes":[{"node_id":"act","kind":"ACT","capability_id":"motion.move_to_pose","arguments":{"frame":"base","xyz_m":[0.2,0.0,0.3],"source":"safe_fixture","side":"left"},"resource_requirements":[{"resource_id":"robot.dual_franka.shared_workspace","mode":"exclusive","description":"resource"}]}],"terminal_nodes":["act"]}
